{
  "version": 1,
  "id": "2026-10-17-she-walks-in-beauty-by-lord",
  "date": "2026-10-17",
  "source": {
    "title": "She Walks in Beauty — Lord Byron"
  },
  "items": [
    {
      "text": "climes",
      "kind": "word",
      "sentence": "By Lord Byron She walks in beauty, like the night Of cloudless climes and starry skies; And all that’s best of dark and bright Meet in her aspect and her eyes; Thus mellowed to that tender light Which heaven to gaudy day denies.",
      "note": ""
    },
    {
      "text": "aspect",
      "kind": "word",
      "sentence": "By Lord Byron She walks in beauty, like the night Of cloudless climes and starry skies; And all that’s best of dark and bright Meet in her aspect and her eyes; Thus mellowed to that tender light Which heaven to gaudy day denies.",
      "note": ""
    },
    {
      "text": "mellowed",
      "kind": "word",
      "sentence": "By Lord Byron She walks in beauty, like the night Of cloudless climes and starry skies; And all that’s best of dark and bright Meet in her aspect and her eyes; Thus mellowed to that tender light Which heaven to gaudy day denies.",
      "note": ""
    },
    {
      "text": "tender",
      "kind": "word",
      "sentence": "By Lord Byron She walks in beauty, like the night Of cloudless climes and starry skies; And all that’s best of dark and bright Meet in her aspect and her eyes; Thus mellowed to that tender light Which heaven to gaudy day denies.",
      "note": ""
    },
    {
      "text": "gaudy",
      "kind": "word",
      "sentence": "By Lord Byron She walks in beauty, like the night Of cloudless climes and starry skies; And all that’s best of dark and bright Meet in her aspect and her eyes; Thus mellowed to that tender light Which heaven to gaudy day denies.",
      "note": ""
    },
    {
      "text": "shade",
      "kind": "word",
      "sentence": "One shade the more, one ray the less, Had half impaired the nameless grace Which waves in every raven tress, Or softly lightens o’er her face; Where thoughts serenely sweet express, How pure, how dear their dwelling-place.",
      "note": ""
    },
    {
      "text": "ray",
      "kind": "word",
      "sentence": "One shade the more, one ray the less, Had half impaired the nameless grace Which waves in every raven tress, Or softly lightens o’er her face; Where thoughts serenely sweet express, How pure, how dear their dwelling-place.",
      "note": ""
    },
    {
      "text": "impaired",
      "kind": "word",
      "sentence": "One shade the more, one ray the less, Had half impaired the nameless grace Which waves in every raven tress, Or softly lightens o’er her face; Where thoughts serenely sweet express, How pure, how dear their dwelling-place.",
      "note": ""
    },
    {
      "text": "grace",
      "kind": "word",
      "sentence": "One shade the more, one ray the less, Had half impaired the nameless grace Which waves in every raven tress, Or softly lightens o’er her face; Where thoughts serenely sweet express, How pure, how dear their dwelling-place.",
      "note": ""
    },
    {
      "text": "raven",
      "kind": "word",
      "sentence": "One shade the more, one ray the less, Had half impaired the nameless grace Which waves in every raven tress, Or softly lightens o’er her face; Where thoughts serenely sweet express, How pure, how dear their dwelling-place.",
      "note": ""
    },
    {
      "text": "tress",
      "kind": "word",
      "sentence": "One shade the more, one ray the less, Had half impaired the nameless grace Which waves in every raven tress, Or softly lightens o’er her face; Where thoughts serenely sweet express, How pure, how dear their dwelling-place.",
      "note": ""
    },
    {
      "text": "softly",
      "kind": "word",
      "sentence": "One shade the more, one ray the less, Had half impaired the nameless grace Which waves in every raven tress, Or softly lightens o’er her face; Where thoughts serenely sweet express, How pure, how dear their dwelling-place.",
      "note": ""
    },
    {
      "text": "lightens",
      "kind": "word",
      "sentence": "One shade the more, one ray the less, Had half impaired the nameless grace Which waves in every raven tress, Or softly lightens o’er her face; Where thoughts serenely sweet express, How pure, how dear their dwelling-place.",
      "note": ""
    },
    {
      "text": "serenely",
      "kind": "word",
      "sentence": "One shade the more, one ray the less, Had half impaired the nameless grace Which waves in every raven tress, Or softly lightens o’er her face; Where thoughts serenely sweet express, How pure, how dear their dwelling-place.",
      "note": ""
    },
    {
      "text": "pure",
      "kind": "word",
      "sentence": "One shade the more, one ray the less, Had half impaired the nameless grace Which waves in every raven tress, Or softly lightens o’er her face; Where thoughts serenely sweet express, How pure, how dear their dwelling-place.",
      "note": ""
    },
    {
      "text": "dwelling-place",
      "kind": "word",
      "sentence": "One shade the more, one ray the less, Had half impaired the nameless grace Which waves in every raven tress, Or softly lightens o’er her face; Where thoughts serenely sweet express, How pure, how dear their dwelling-place.",
      "note": ""
    },
    {
      "text": "o’er",
      "kind": "word",
      "sentence": "And on that cheek, and o’er that brow, So soft, so calm, yet eloquent, The smiles that win, the tints that glow, But tell of days in goodness spent, A mind at peace with all below, A heart whose love is innocent!",
      "note": ""
    },
    {
      "text": "brow",
      "kind": "word",
      "sentence": "And on that cheek, and o’er that brow, So soft, so calm, yet eloquent, The smiles that win, the tints that glow, But tell of days in goodness spent, A mind at peace with all below, A heart whose love is innocent!",
      "note": ""
    },
    {
      "text": "calm",
      "kind": "word",
      "sentence": "And on that cheek, and o’er that brow, So soft, so calm, yet eloquent, The smiles that win, the tints that glow, But tell of days in goodness spent, A mind at peace with all below, A heart whose love is innocent!",
      "note": ""
    },
    {
      "text": "eloquent",
      "kind": "word",
      "sentence": "And on that cheek, and o’er that brow, So soft, so calm, yet eloquent, The smiles that win, the tints that glow, But tell of days in goodness spent, A mind at peace with all below, A heart whose love is innocent!",
      "note": ""
    },
    {
      "text": "tints",
      "kind": "word",
      "sentence": "And on that cheek, and o’er that brow, So soft, so calm, yet eloquent, The smiles that win, the tints that glow, But tell of days in goodness spent, A mind at peace with all below, A heart whose love is innocent!",
      "note": ""
    },
    {
      "text": "glow",
      "kind": "word",
      "sentence": "And on that cheek, and o’er that brow, So soft, so calm, yet eloquent, The smiles that win, the tints that glow, But tell of days in goodness spent, A mind at peace with all below, A heart whose love is innocent!",
      "note": ""
    },
    {
      "text": "peace",
      "kind": "word",
      "sentence": "And on that cheek, and o’er that brow, So soft, so calm, yet eloquent, The smiles that win, the tints that glow, But tell of days in goodness spent, A mind at peace with all below, A heart whose love is innocent!",
      "note": ""
    },
    {
      "text": "below",
      "kind": "word",
      "sentence": "And on that cheek, and o’er that brow, So soft, so calm, yet eloquent, The smiles that win, the tints that glow, But tell of days in goodness spent, A mind at peace with all below, A heart whose love is innocent!",
      "note": ""
    },
    {
      "text": "innocent",
      "kind": "word",
      "sentence": "And on that cheek, and o’er that brow, So soft, so calm, yet eloquent, The smiles that win, the tints that glow, But tell of days in goodness spent, A mind at peace with all below, A heart whose love is innocent!",
      "note": ""
    }
  ]
}
