{
  "version": 1,
  "id": "2026-10-26-how-to-be-more-ambitious-a",
  "date": "2026-10-26",
  "source": {
    "title": "How to be more ambitious A"
  },
  "items": [
    {
      "text": "ambitious",
      "kind": "word",
      "sentence": "How to be more ambitious: A tutorial for humans with models Published 13 October 2026 Reading time 8 min Topics claude How to be more ambitious: A tutorial for humans with models I work on Claude.",
      "note": ""
    },
    {
      "text": "accomplished",
      "kind": "word",
      "sentence": "It’s an interesting experience: Every day I learn about yet another feat accomplished with or by Claude that I hadn’t considered, didn’t think possible, or simply lacked the curiosity and time to try.",
      "note": ""
    },
    {
      "text": "considered",
      "kind": "word",
      "sentence": "It’s an interesting experience: Every day I learn about yet another feat accomplished with or by Claude that I hadn’t considered, didn’t think possible, or simply lacked the curiosity and time to try.",
      "note": ""
    },
    {
      "text": "lacked",
      "kind": "word",
      "sentence": "It’s an interesting experience: Every day I learn about yet another feat accomplished with or by Claude that I hadn’t considered, didn’t think possible, or simply lacked the curiosity and time to try.",
      "note": ""
    },
    {
      "text": "curiosity",
      "kind": "word",
      "sentence": "It’s an interesting experience: Every day I learn about yet another feat accomplished with or by Claude that I hadn’t considered, didn’t think possible, or simply lacked the curiosity and time to try.",
      "note": ""
    },
    {
      "text": "inadequate",
      "kind": "word",
      "sentence": "Models are, as Terence Tao puts it, “astounding in some directions, while inadequate in others”.",
      "note": ""
    },
    {
      "text": "astounding",
      "kind": "word",
      "sentence": "Some people manage to pilot the astounding capabilities and seem to be flying — it’s addicting to watch people reach incredible heights with the products I’ve built.",
      "note": ""
    },
    {
      "text": "incredible",
      "kind": "word",
      "sentence": "Some people manage to pilot the astounding capabilities and seem to be flying — it’s addicting to watch people reach incredible heights with the products I’ve built.",
      "note": ""
    },
    {
      "text": "struggling",
      "kind": "word",
      "sentence": "Many others are still struggling to get their new wings to work, wondering what they’re good for beyond asking “What is the capital of France” or “Can you make this email sound less angry”.",
      "note": ""
    },
    {
      "text": "beyond",
      "kind": "word",
      "sentence": "Many others are still struggling to get their new wings to work, wondering what they’re good for beyond asking “What is the capital of France” or “Can you make this email sound less angry”.",
      "note": ""
    },
    {
      "text": "proclaim",
      "kind": "word",
      "sentence": "I frequently proclaim (together with other people working on AI) that we ought to be more ambitious when using it.",
      "note": ""
    },
    {
      "text": "established",
      "kind": "word",
      "sentence": "Well established and requires little creativity in how you approach AI, so I’ll skip this one.",
      "note": ""
    },
    {
      "text": "Altitude",
      "kind": "word",
      "sentence": "Altitude: Going up in abstraction and considering the outcome rather than the individual task.",
      "note": ""
    },
    {
      "text": "underlying",
      "kind": "word",
      "sentence": "Rather than operating at the task’s layer, we go one level deeper and touch the underlying data, tools, and problems.",
      "note": ""
    },
    {
      "text": "flippantly",
      "kind": "word",
      "sentence": "Altitude We often flippantly call this “letting the model operate at a higher abstraction”.",
      "note": ""
    },
    {
      "text": "outcome",
      "kind": "word",
      "sentence": "When you give the model a task, it’s executing your best guess at how to get the outcome you want.",
      "note": ""
    },
    {
      "text": "quarterly",
      "kind": "word",
      "sentence": "You’re at Acme Inc, an imagined company, where you need to put together a deck for the quarterly business review (QBR).",
      "note": ""
    },
    {
      "text": "altitude approach",
      "kind": "phrase",
      "sentence": "The altitude approach works best if you really are after some ultimate outcome; it works less well for creative endeavors.",
      "note": ""
    },
    {
      "text": "ultimate outcome",
      "kind": "phrase",
      "sentence": "The altitude approach works best if you really are after some ultimate outcome; it works less well for creative endeavors.",
      "note": ""
    },
    {
      "text": "prompted",
      "kind": "word",
      "sentence": "Insist on the same instruments used by the best in the industry: When prompted to act like a professional, models often switch vocabulary without actually switching methods.",
      "note": ""
    },
    {
      "text": "rough",
      "kind": "word",
      "sentence": "Challenge what you know: Especially in business, a lot of things we believe to be true are rough approximations of reality.",
      "note": ""
    },
    {
      "text": "insight",
      "kind": "word",
      "sentence": "This isn’t a particularly unique insight, every single heist movie spends the first 30 minutes assembling a diverse cast of characters and talents.",
      "note": ""
    },
    {
      "text": "forensic",
      "kind": "word",
      "sentence": "It might be useful to employ an adversarial “red team”, too, so let’s bring in a short seller and a forensic accountant.",
      "note": ""
    },
    {
      "text": "engage",
      "kind": "word",
      "sentence": "It is easy to accidentally engage in role play, which will make your transcript weirder without improving the actual outcome.",
      "note": ""
    },
    {
      "text": "Plenty",
      "kind": "word",
      "sentence": "Plenty of tools make this possible and I recommend that you use one.",
      "note": ""
    },
    {
      "text": "self-efficacy",
      "kind": "word",
      "sentence": "While researching the problem of ambition, I learned that psychology has a name for this: self-efficacy.",
      "note": ""
    },
    {
      "text": "audacious",
      "kind": "word",
      "sentence": "Stripe founder Patrick Collison maintains a “Fast” list, chronicling the many things humans have accomplished when given both audacious goals and tight deadlines.",
      "note": ""
    },
    {
      "text": "tight",
      "kind": "word",
      "sentence": "Stripe founder Patrick Collison maintains a “Fast” list, chronicling the many things humans have accomplished when given both audacious goals and tight deadlines.",
      "note": ""
    }
  ]
}
